<?xml version="1.0" encoding="UTF-8"?>
<builder
    xmlns="http://www.mmbase.org/xmlns/builder"
    xmlns:xsi="http://www.w3.org/2001/XMLSchema-instance"
    xsi:schemaLocation="http://www.mmbase.org/xmlns/builder 
                        http://www.mmbase.org/xmlns/builder.xsd"
	extends="insrel" maintainer="finalist.com" name="contentrel" version="1">
<!--
 
-->
   <status>active</status>
   <!--
   <class>ContentRepository.Contentrel</class>
   -->
   <searchage>70</searchage>
   <names>
      <singular xml:lang="nl">contentrel</singular>
      <singular xml:lang="en">contentrel</singular>
	  <singular xml:lang="zh">内容连接</singular>
      <plural xml:lang="nl">contentrel</plural>
      <plural xml:lang="en">contentrel</plural>
	  <plural xml:lang="zh">内容连接</plural>
   </names>
   <descriptions>
      <description xml:lang="nl"></description>
      <description xml:lang="en"></description>
	  <description xml:lang="zh"></description>
   </descriptions>
	<properties>
		</properties>
   <fieldlist>
      <field>
         <descriptions>
            <description xml:lang="nl"></description>
            <description xml:lang="en"></description>
			<description xml:lang="zh"></description>
         </descriptions>
         <gui>
            <guiname xml:lang="nl">Positie</guiname>
            <guiname xml:lang="en">pos</guiname>
			<guiname xml:lang="zh">位置</guiname>
         </gui>
         <editor>
            <positions>
                                           <input>4</input>
               <list>-1</list>
               <search>-1</search>
            </positions>
         </editor>
         <db>
            <name>pos</name>
            <type key="false" notnull="false" state="persistent">INTEGER</type>
         </db>
      </field>
</fieldlist>
</builder>
