<?xml version="1.0" encoding="UTF-8"?>
<builder xmlns="http://www.mmbase.org/xmlns/builder" 
         xmlns:xsi="http://www.w3.org/2001/XMLSchema-instance" 
         xsi:schemaLocation="http://www.mmbase.org/xmlns/builder http://www.mmbase.org/xmlns/builder.xsd" 
   name="systemproperties" maintainer="mmbase.org" version="1" extends="object">

   <searchage>1000</searchage>
   <names>
      <singular xml:lang="nl">Systeem instelling</singular>
      <singular xml:lang="en">System properties</singular>
    <singular xml:lang="zh">属性</singular>
      <plural xml:lang="nl">System instellingen</plural>
      <plural xml:lang="en">System properties</plural>
    <plural xml:lang="zh">属性</plural>
   </names>
   <descriptions>
      <description xml:lang="nl"/>
      <description xml:lang="en"/>
    <description xml:lang="zh"/>
   </descriptions>

   <fieldlist>
      <field name="key" state="persistent">
         <descriptions>
            <description xml:lang="nl"/>
            <description xml:lang="en"/>
            <description xml:lang="zh"/>
         </descriptions>
         <gui>
            <guiname xml:lang="nl">Naam</guiname>
            <guiname xml:lang="en">Key</guiname>
            <guiname xml:lang="zh">关键字</guiname>
         </gui>
         <editor>
            <positions>
               <input>4</input>
               <list>4</list>
               <search>4</search>
            </positions>
         </editor>
         <datatype xmlns="http://www.mmbase.org/xmlns/datatypes" base="line">
            <unique value="true"/>
            <required value="true"/>
            <maxLength value="128"/>
         </datatype>
      </field>
      <field name="description" state="persistent">
         <descriptions>
            <description xml:lang="nl"/>
            <description xml:lang="en"/>
            <description xml:lang="zh"/>
         </descriptions>
         <gui>
            <guiname xml:lang="nl">Omschrijving</guiname>
            <guiname xml:lang="en">Description</guiname>
            <guiname xml:lang="zh">描述</guiname>
         </gui>
         <editor>
            <positions>
               <input>5</input>
            </positions>
         </editor>
         <datatype xmlns="http://www.mmbase.org/xmlns/datatypes" base="field">
            <maxLength value="1024"/>
         </datatype>
      </field>
      <field name="value" state="persistent">
         <descriptions>
            <description xml:lang="nl"/>
            <description xml:lang="en"/>
            <description xml:lang="zh"/>
         </descriptions>
         <gui>
            <guiname xml:lang="nl">Waarde</guiname>
            <guiname xml:lang="en">Value</guiname>
            <guiname xml:lang="zh">值</guiname>
         </gui>
         <editor>
            <positions>
               <input>6</input>
               <list>-1</list>
               <search>-1</search>
            </positions>
         </editor>
         <datatype base="field" xmlns="http://www.mmbase.org/xmlns/datatypes">
            <required value="true"/>
            <maxLength value="1024"/>
         </datatype>
      </field>
      <field name="production" state="persistent">
         <descriptions>
            <description xml:lang="nl"/>
            <description xml:lang="en"/>
            <description xml:lang="zh"/>
         </descriptions>
         <gui>
            <guiname xml:lang="nl">Productie</guiname>
            <guiname xml:lang="en">Production</guiname>
            <guiname xml:lang="zh">生产</guiname>
         </gui>
         <editor>
            <positions>
               <input>7</input>
               <list>-1</list>
               <search>-1</search>
            </positions>
         </editor>
         <datatype base="field" xmlns="http://www.mmbase.org/xmlns/datatypes">
            <required value="true"/>
            <maxLength value="1024"/>
         </datatype>
      </field>
      <field name="acceptance" state="persistent">
         <descriptions>
            <description xml:lang="nl"/>
            <description xml:lang="en"/>
            <description xml:lang="zh"/>
         </descriptions>
         <gui>
            <guiname xml:lang="nl">Acceptatie</guiname>
            <guiname xml:lang="en">Acceptance</guiname>
            <guiname xml:lang="zh">认可</guiname>
         </gui>
         <editor>
            <positions>
               <input>8</input>
               <list>-1</list>
               <search>-1</search>
            </positions>
         </editor>
         <datatype base="field" xmlns="http://www.mmbase.org/xmlns/datatypes">
            <required value="true"/>
            <maxLength value="1024"/>
         </datatype>
      </field>
      <field name="test" state="persistent">
         <descriptions>
            <description xml:lang="nl"/>
            <description xml:lang="en"/>
            <description xml:lang="zh"/>
         </descriptions>
         <gui>
            <guiname xml:lang="nl">Test</guiname>
            <guiname xml:lang="en">Test</guiname>
            <guiname xml:lang="zh">测试</guiname>
         </gui>
         <editor>
            <positions>
               <input>9</input>
               <list>-1</list>
               <search>-1</search>
            </positions>
         </editor>
         <datatype base="field" xmlns="http://www.mmbase.org/xmlns/datatypes">
            <required value="true"/>
            <maxLength value="1024"/>
         </datatype>
      </field>
      <field name="development" state="persistent">
         <descriptions>
            <description xml:lang="nl"/>
            <description xml:lang="en"/>
            <description xml:lang="zh"/>
         </descriptions>
         <gui>
            <guiname xml:lang="nl">Development</guiname>
            <guiname xml:lang="en">Development</guiname>
            <guiname xml:lang="zh">开发</guiname>
         </gui>
         <editor>
            <positions>
               <input>10</input>
               <list>-1</list>
               <search>-1</search>
            </positions>
         </editor>
         <datatype base="field" xmlns="http://www.mmbase.org/xmlns/datatypes">
            <required value="true"/>
            <maxLength value="1024"/>
         </datatype>
      </field>
      <field name="component" state="persistent">
         <descriptions>
            <description xml:lang="nl"/>
            <description xml:lang="en"/>
            <description xml:lang="zh"/>
         </descriptions>
         <gui>
            <guiname xml:lang="nl">Component</guiname>
            <guiname xml:lang="en">Component</guiname>
            <guiname xml:lang="zh">模型</guiname>
         </gui>
         <editor>
            <positions>
               <input>10</input>
               <list>-1</list>
               <search>-1</search>
            </positions>
         </editor>
         <datatype base="field" xmlns="http://www.mmbase.org/xmlns/datatypes">
            <required value="true"/>
            <maxLength value="1024"/>
         </datatype>
      </field>
   </fieldlist>
</builder>