<?xml version="1.0" encoding="UTF-8"?>
<builder extends="insrel" maintainer="finalist.com" name="workflowrel"
    version="1" xmlns="http://www.mmbase.org/xmlns/builder"
    xmlns:xsi="http://www.w3.org/2001/XMLSchema-instance" xsi:schemaLocation="http://www.mmbase.org/xmlns/builder http://www.mmbase.org/xmlns/builder.xsd">
    <names>
        <singular xml:lang="nl">workflowrel</singular>
        <singular xml:lang="en">workflowrel</singular>
        <singular xml:lang="zh">工作流链接</singular>
        <plural xml:lang="nl">workflowrel</plural>
        <plural xml:lang="en">workflowrel</plural>
        <plural xml:lang="zh">工作流链接</plural>
    </names>
    <fieldlist/>
</builder>
