<?xml version="1.0" encoding="UTF-8"?>
<builder xmlns="http://www.mmbase.org/xmlns/builder"
	xmlns:xsi="http://www.w3.org/2001/XMLSchema-instance"
	xsi:schemaLocation="http://www.mmbase.org/xmlns/builder 
                        http://www.mmbase.org/xmlns/builder.xsd"
	extends="object" maintainer="finalist.com" name="guestmessage" version="1">

	<status>active</status>
<!-- <class>com.finalist.cmsc.richtext.builders.RichTextBuilder</class>  -->
	<searchage>70</searchage>
	<names>
		<singular xml:lang="nl">Bericht</singular>
		<singular xml:lang="en">Message</singular>
		<singular xml:lang="zh">信息</singular>
		<plural xml:lang="nl">Berichten</plural>
		<plural xml:lang="en">Messages</plural>
		<plural xml:lang="zh">信息</plural>
	</names>
	<descriptions>
		<description xml:lang="nl"></description>
		<description xml:lang="en"></description>
		<description xml:lang="zh"></description>
	</descriptions>
	<properties>
	</properties>
	<fieldlist>
		<field>
			<descriptions>
				<description xml:lang="nl"></description>
				<description xml:lang="en"></description>
				<description xml:lang="zh"></description>
			</descriptions>
			<gui>
				<guiname xml:lang="nl">Titel</guiname>
				<guiname xml:lang="en">Title</guiname>
				<guiname xml:lang="zh">标题</guiname>
			</gui>
			<editor>
				<positions>
					<input>10</input>
					<list>10</list>
					<search>10</search>
				</positions>
			</editor>
			<datatype base="line" xmlns="http://www.mmbase.org/xmlns/datatypes" />
			<db>
				<name>title</name>
				<type key="false" notnull="true" size="512" state="persistent">STRING</type>
			</db>
		</field>
		<field>
			<descriptions>
				<description xml:lang="nl"></description>
				<description xml:lang="en"></description>
				<description xml:lang="zh"></description>
			</descriptions>
			<gui>
				<guiname xml:lang="nl">Naam</guiname>
				<guiname xml:lang="en">Name</guiname>
				<guiname xml:lang="zh">名称</guiname>
			</gui>
			<editor>
				<positions>
					<input>10</input>
					<list>10</list>
					<search>10</search>
				</positions>
			</editor>
			<datatype base="line" xmlns="http://www.mmbase.org/xmlns/datatypes" />
			<db>
				<name>name</name>
				<type key="false" notnull="true" size="512" state="persistent">STRING</type>
			</db>
		</field>
        <field>
            <descriptions>
                <description xml:lang="nl"></description>
                <description xml:lang="en"></description>
				<description xml:lang="zh"></description>
            </descriptions>
            <gui>
                <guiname xml:lang="nl">Email</guiname>
                <guiname xml:lang="en">Email</guiname>
				<guiname xml:lang="zh">邮件</guiname>
            </gui>
            <editor>
                <positions>
                    <input>10</input>
                    <list>10</list>
                    <search>10</search>
                </positions>
            </editor>
            <datatype base="line" xmlns="http://www.mmbase.org/xmlns/datatypes" />
            <db>
                <name>email</name>
                <type key="false" notnull="false" size="255" state="persistent">STRING</type>
            </db>
        </field>
		<field>
			<descriptions>
				<description xml:lang="nl"></description>
				<description xml:lang="en"></description>
				<description xml:lang="zh"></description>
			</descriptions>
			<gui>
				<guiname xml:lang="nl">Aangemaakt</guiname>
				<guiname xml:lang="en">Creationdate</guiname>
				<guiname xml:lang="zh">创建时间</guiname>
			</gui>
			<editor>
				<positions>
					<input>4</input>
					<list>-1</list>
					<search>-1</search>
				</positions>
			</editor>
			<datatype base="created" xmlns="http://www.mmbase.org/xmlns/datatypes" />
			<db>
				<name>creationdate</name>
				<type key="false" notnull="false" state="system">DATETIME</type>
			</db>
		</field>
		<field>
			<descriptions>
				<description xml:lang="nl"></description>
				<description xml:lang="en"></description>
				<description xml:lang="zh"></description>
			</descriptions>
			<gui>
				<guiname xml:lang="nl">Tekst</guiname>
				<guiname xml:lang="en">Body</guiname>
				<guiname xml:lang="zh">主体</guiname>
			</gui>
			<editor>
				<positions>
					<input>6</input>
					<list>-1</list>
					<search>-1</search>
				</positions>
			</editor>
			<datatype base="cmscrichtext" xmlns="http://www.mmbase.org/xmlns/datatypes" />
			<db>
				<name>body</name>
				<type key="false" notnull="false" size="512000" state="persistent">STRING</type>
			</db>
		</field>
	</fieldlist>
</builder>
