<?xml version="1.0" encoding="UTF-8"?>
<builder extends="object" maintainer="mmbase.org" name="savedfieldvalue"
    version="1" xmlns="http://www.mmbase.org/xmlns/builder"
    xmlns:xsi="http://www.w3.org/2001/XMLSchema-instance" xsi:schemaLocation="http://www.mmbase.org/xmlns/builder http://www.mmbase.org/xmlns/builder.xsd">
    <names>
        <singular xml:lang="nl">Opgeslagen veldwaarde</singular>
        <singular xml:lang="en">Saved field value</singular>
        <singular xml:lang="zh">保存框值</singular>
        <plural xml:lang="nl">Opgeslagen veldwaarden</plural>
        <plural xml:lang="en">Saved field value</plural>
        <plural xml:lang="zh">保存框值</plural>
    </names>
    <fieldlist>
        <field name="field">
            <gui>
                <guiname xml:lang="nl">Veld</guiname>
                <guiname xml:lang="en">Field</guiname>
                <guiname xml:lang="zh">框</guiname>
            </gui>
            <editor>
                <positions>
                    <input>4</input>
                </positions>
            </editor>
            <datatype base="line" xmlns="http://www.mmbase.org/xmlns/datatypes">
                <maxLength value="255"/>
            </datatype>
        </field>
        <field name="value">
            <gui>
                <guiname xml:lang="nl">Waarde</guiname>
                <guiname xml:lang="en">Value</guiname>
                <guiname xml:lang="zh">值</guiname>
            </gui>
            <editor>
                <positions>
                    <input>5</input>
                </positions>
            </editor>
            <datatype base="line" xmlns="http://www.mmbase.org/xmlns/datatypes">
                <maxLength value="64000"/>
            </datatype>
        </field>
    </fieldlist>
</builder>
