<?xml version="1.0" encoding="UTF-8"?>
<builder
    xmlns="http://www.mmbase.org/xmlns/builder"
    xmlns:xsi="http://www.w3.org/2001/XMLSchema-instance"
    xsi:schemaLocation="http://www.mmbase.org/xmlns/builder 
                        http://www.mmbase.org/xmlns/builder.xsd"
	extends="object" maintainer="finalist.com" name="properties" version="1">
<!--
 
-->
   <status>active</status>
   <!--
   <class>Utilities.Properties</class>
   -->
   <searchage>70</searchage>
   <names>
      <singular xml:lang="nl">properties</singular>
      <singular xml:lang="en">properties</singular>
	  <singular xml:lang="zh">属性</singular>
      <plural xml:lang="nl">properties</plural>
      <plural xml:lang="en">properties</plural>
	  <plural xml:lang="zh">属性</plural>
   </names>
   <descriptions>
      <description xml:lang="nl"></description>
      <description xml:lang="en"></description>
	  <description xml:lang="zh"></description>
   </descriptions>

	<properties></properties>
   <fieldlist>
      <field>
         <descriptions>
            <description xml:lang="nl"></description>
            <description xml:lang="en"></description>
			<description xml:lang="zh"></description>
         </descriptions>
         <gui>
            <guiname xml:lang="nl">Naam</guiname>
			<guiname xml:lang="en">Key</guiname>
			<guiname xml:lang="zh">关键字</guiname>
         </gui>
         <editor>
            <positions>
					<input>4</input>
					<list>4</list>
					<search>4</search>
            </positions>
         </editor>
			<datatype base="line" xmlns="http://www.mmbase.org/xmlns/datatypes" />
         <db>
            <name>key</name>
            <type key="false" notnull="false" size="40" state="persistent">STRING</type>
         </db>
      </field>
      <field>
         <descriptions>
            <description xml:lang="nl"></description>
            <description xml:lang="en"></description>
			<description xml:lang="zh"></description>
         </descriptions>
         <gui>
            <guiname xml:lang="nl">Omschrijving</guiname>
            <guiname xml:lang="en">Description</guiname>
			<guiname xml:lang="zh">描述</guiname>
         </gui>
         <editor>
            <positions>
               <input>5</input>
               <list>-1</list>
               <search>-1</search>
            </positions>
         </editor>
			<datatype base="field" xmlns="http://www.mmbase.org/xmlns/datatypes" />
         <db>
            <name>description</name>
            <type key="false" notnull="false" size="1024" state="persistent">STRING</type>
         </db>
      </field>
      <field>
         <descriptions>
            <description xml:lang="nl"></description>
            <description xml:lang="en"></description>
			<description xml:lang="zh"></description>
         </descriptions>
         <gui>
            <guiname xml:lang="nl">Waarde</guiname>
			<guiname xml:lang="en">Value</guiname>
			<guiname xml:lang="zh">值</guiname>
         </gui>
         <editor>
            <positions>
               <input>6</input>
               <list>-1</list>
               <search>-1</search>
            </positions>
         </editor>
			<datatype base="field" xmlns="http://www.mmbase.org/xmlns/datatypes" />
         <db>
            <name>value</name>
            <type key="false" notnull="false" size="255" state="persistent">STRING</type>
         </db>
      </field>
      <field>
         <descriptions>
            <description xml:lang="nl"></description>
            <description xml:lang="en"></description>
			<description xml:lang="zh"></description>
         </descriptions>
         <gui>
            <guiname xml:lang="nl">Productie</guiname>
			<guiname xml:lang="en">Production</guiname>
			<guiname xml:lang="zh">生产</guiname>
         </gui>
         <editor>
            <positions>
               <input>7</input>
               <list>-1</list>
               <search>-1</search>
            </positions>
         </editor>
			<datatype base="field" xmlns="http://www.mmbase.org/xmlns/datatypes" />
         <db>
            <name>prod</name>
            <type key="false" notnull="false" size="255" state="persistent">STRING</type>
         </db>
      </field>
      <field>
         <descriptions>
            <description xml:lang="nl"></description>
            <description xml:lang="en"></description>
			<description xml:lang="zh"></description>
         </descriptions>
         <gui>
            <guiname xml:lang="nl">Acceptatie</guiname>
			<guiname xml:lang="en">Acceptance</guiname>
			<guiname xml:lang="zh">认可</guiname>
         </gui>
         <editor>
            <positions>
               <input>8</input>
               <list>-1</list>
               <search>-1</search>
            </positions>
         </editor>
			<datatype base="field" xmlns="http://www.mmbase.org/xmlns/datatypes" />
         <db>
            <name>preprod</name>
            <type key="false" notnull="false" size="255" state="persistent">STRING</type>
         </db>
      </field>
      <field>
         <descriptions>
            <description xml:lang="nl"></description>
            <description xml:lang="en"></description>
			<description xml:lang="zh"></description>
         </descriptions>
         <gui>
            <guiname xml:lang="nl">Test</guiname>
			<guiname xml:lang="en">Test</guiname>
			<guiname xml:lang="zh">测试</guiname>
         </gui>
         <editor>
            <positions>
               <input>9</input>
               <list>-1</list>
               <search>-1</search>
            </positions>
         </editor>
			<datatype base="field" xmlns="http://www.mmbase.org/xmlns/datatypes" />
         <db>
            <name>test</name>
            <type key="false" notnull="false" size="255" state="persistent">STRING</type>
         </db>
      </field>
      <field>
         <descriptions>
            <description xml:lang="nl"></description>
            <description xml:lang="en"></description>
			<description xml:lang="zh"></description>
         </descriptions>
         <gui>
            <guiname xml:lang="nl">Development</guiname>
			<guiname xml:lang="en">Development</guiname>
			<guiname xml:lang="zh">开发</guiname>
         </gui>
         <editor>
            <positions>
               <input>10</input>
               <list>-1</list>
               <search>-1</search>
            </positions>
         </editor>
			<datatype base="field" xmlns="http://www.mmbase.org/xmlns/datatypes" />
         <db>
            <name>dev</name>
            <type key="false" notnull="false" size="255" state="persistent">STRING</type>
         </db>
      </field>
      <field>
         <descriptions>
            <description xml:lang="nl"></description>
            <description xml:lang="en"></description>
			<description xml:lang="zh"></description>
         </descriptions>
         <gui>
            <guiname xml:lang="nl">Module</guiname>
			<guiname xml:lang="en">Module</guiname>
			<guiname xml:lang="zh">模型</guiname>
         </gui>
         <editor>
            <positions>
               <input>10</input>
               <list>-1</list>
               <search>-1</search>
            </positions>
         </editor>
			<datatype base="field" xmlns="http://www.mmbase.org/xmlns/datatypes" />
         <db>
            <name>module</name>
            <type key="false" notnull="false" size="255" state="persistent">STRING</type>
         </db>
      </field>
</fieldlist>
</builder>
