<?xml version="1.0" encoding="UTF-8"?>
<builder extends="object" maintainer="mmbase.org" name="remotenodes" version="1"
    xmlns="http://www.mmbase.org/xmlns/builder"
    xmlns:xsi="http://www.w3.org/2001/XMLSchema-instance" xsi:schemaLocation="http://www.mmbase.org/xmlns/builder http://www.mmbase.org/xmlns/builder.xsd">
    <searchage>14</searchage>
    <names>
        <singular xml:lang="us">RemoteNode</singular>
        <singular xml:lang="en">RemoteNode</singular>
        <singular xml:lang="nl">RemoteNode</singular>
        <plural xml:lang="us">RemoteNodes</plural>
        <plural xml:lang="en">RemoteNodes</plural>
        <plural xml:lang="nl">RemoteNodes</plural>
    </names>
    <descriptions>
        <description xml:lang="us">RemoteNodes are used to map remote mmbase nodes to this node</description>
        <description xml:lang="en">RemoteNodes are used to map remote mmbase nodes to this node</description>
        <description xml:lang="nl">RemoteNodes worden gebruikt om remote mmbase nodes te mappen naar lokale nodes</description>
    </descriptions>
    <fieldlist>
        <field name="timestamp" state="system">
            <gui>
                <guiname xml:lang="us">TimeStamp</guiname>
                <guiname xml:lang="en">TimeStamp</guiname>
                <guiname xml:lang="nl">TijdStempel</guiname>
            </gui>
            <editor>
                <positions>
                    <input>2</input>
                    <list>2</list>
                    <search>2</search>
                </positions>
            </editor>
            <datatype base="lastmodified" xmlns="http://www.mmbase.org/xmlns/datatypes"/>
        </field>
        <field name="sourcecloud">
            <gui>
                <guiname xml:lang="us">SourceCloud</guiname>
                <guiname xml:lang="en">SourceCloud</guiname>
                <guiname xml:lang="nl">SourceCloud</guiname>
            </gui>
            <editor>
                <positions>
                    <input>3</input>
                    <list>3</list>
                    <search>3</search>
                </positions>
            </editor>
            <datatype base="integer" xmlns="http://www.mmbase.org/xmlns/datatypes">
                <required value="true"/>
            </datatype>
        </field>
        <field name="sourcenumber">
            <gui>
                <guiname xml:lang="us">SourceNumber</guiname>
                <guiname xml:lang="en">SourceNumber</guiname>
                <guiname xml:lang="nl">SourceNummer</guiname>
            </gui>
            <editor>
                <positions>
                    <input>4</input>
                    <list>4</list>
                    <search>4</search>
                </positions>
            </editor>
            <datatype base="integer" xmlns="http://www.mmbase.org/xmlns/datatypes">
                <required value="true"/>
            </datatype>
        </field>
        <field name="destinationcloud">
            <gui>
                <guiname xml:lang="us">DestinationCloud</guiname>
                <guiname xml:lang="en">DestinationCloud</guiname>
                <guiname xml:lang="nl">DestinationCloud</guiname>
            </gui>
            <editor>
                <positions>
                    <input>5</input>
                    <list>5</list>
                    <search>5</search>
                </positions>
            </editor>
            <datatype base="integer" xmlns="http://www.mmbase.org/xmlns/datatypes">
                <required value="true"/>
            </datatype>
        </field>
        <field name="destinationnumber">
            <gui>
                <guiname xml:lang="us">DestinationNumber</guiname>
                <guiname xml:lang="en">DestinationNumber</guiname>
                <guiname xml:lang="nl">DestinationNumber</guiname>
            </gui>
            <editor>
                <positions>
                    <input>6</input>
                    <list>6</list>
                    <search>6</search>
                </positions>
            </editor>
            <datatype base="integer" xmlns="http://www.mmbase.org/xmlns/datatypes">
                <required value="true"/>
            </datatype>
        </field>
    </fieldlist>
    <indexlist>
        <index name="src">
            <indexfield name="sourcenumber"/>
            <indexfield name="sourcecloud"/>
        </index>
        <index name="dest">
            <indexfield name="destinationnumber"/>
            <indexfield name="destinationcloud"/>
        </index>
    </indexlist>
</builder>
