<?xml version="1.0" encoding="UTF-8"?>
<builder
    xmlns="http://www.mmbase.org/xmlns/builder"
    xmlns:xsi="http://www.w3.org/2001/XMLSchema-instance"
    xsi:schemaLocation="http://www.mmbase.org/xmlns/builder http://www.mmbase.org/xmlns/builder.xsd"
    name="ip" maintainer="mmbase.org" version="1" extends="object"> 
  <names>
    <singular xml:lang="en">IP</singular>
    <singular xml:lang="nl">IP</singular>
    <singular xml:lang="eo">IP</singular>
    <plural xml:lang="en">IPs</plural>
    <plural xml:lang="nl">IPs</plural>
    <plural xml:lang="eo">IP-oj</plural>
  </names>

  <fieldlist>
    <field name="IP">
      <editor>
        <positions>
          <list>1</list>
        </positions>
      </editor>
      <datatype base="eline" xmlns="http://www.mmbase.org/xmlns/datatypes">
        <maxLength value="255" />
      </datatype>
    </field>
    <field name="poll">
      <gui>
        <guiname xml:lang="en">Poll</guiname>
        <guiname xml:lang="nl">Poll</guiname>
        <guiname xml:lang="eo">Enketo</guiname>
      </gui>
      <editor>
        <positions>
          <list>2</list>
        </positions>
      </editor>
      <datatype base="node" xmlns="http://www.mmbase.org/xmlns/datatypes">
        <enumeration>
          <query type="poll" xmlns="http://www.mmbase.org/xmlns/searchquery" />
        </enumeration>
      </datatype>
    </field>
    <field name="answer">
      <gui>
        <guiname xml:lang="en">Answer</guiname>
        <guiname xml:lang="nl">Antwoord</guiname>
        <guiname xml:lang="eo">Respondo</guiname>
      </gui>
      <editor>
        <positions>
          <list>3</list>
        </positions>
      </editor>
      <datatype base="node" xmlns="http://www.mmbase.org/xmlns/datatypes">
        <enumeration>
          <query type="answer" xmlns="http://www.mmbase.org/xmlns/searchquery" />
        </enumeration>
      </datatype>
    </field>
    <field name="date">
      <gui>
        <guiname xml:lang="en">Date</guiname>
        <guiname xml:lang="nl">Datum</guiname>
        <guiname xml:lang="eo">Dato</guiname>
      </gui>
      <editor>
        <positions>
          <input>4</input>
          <list>4</list>
          <search>4</search>
        </positions>
      </editor>
      <datatype base="created" xmlns="http://www.mmbase.org/xmlns/datatypes" /> 
    </field>

  </fieldlist>
</builder>
